{
 "type": "instructions",
 "schema_version": 1,
 "practice": "vbt-body-as-awareness",
 "source": "satsang-vbt-summaries",
 "stages": [
  {
   "id": "whole-field",
   "label": "The whole body at once"
  },
  {
   "id": "awareness",
   "label": "Body and world as awareness"
  }
 ],
 "instructions": [
  {
   "id": "i01",
   "stage": "whole-field",
   "action": "attend",
   "spans": [
    {
     "passage": "vbt-body:p1.s1",
     "quote": "Sit and let attention rest on the whole body at once: not one part, the whole field of sensation.",
     "segment": "vbt-body",
     "start": 0,
     "end": 97
    }
   ],
   "count": {
    "value": 4,
    "unit": "breaths"
   },
   "attention": {
    "target": "whole_body",
    "size": "whole"
   },
   "prov": {
    "count": {
     "basis": "inferred",
     "rule": "explore-breaths"
    }
   },
   "scripted": true,
   "confidence": 0.92
  },
  {
   "id": "i02",
   "stage": "awareness",
   "action": "attend",
   "spans": [
    {
     "passage": "vbt-body:p1.s2",
     "quote": "Then take the body, and the world around it, as made of awareness.",
     "segment": "vbt-body",
     "start": 98,
     "end": 164
    }
   ],
   "count": {
    "value": 4,
    "unit": "breaths"
   },
   "attention": {
    "target": "whole_body",
    "size": "wide"
   },
   "prov": {
    "count": {
     "basis": "inferred",
     "rule": "explore-breaths"
    },
    "attention": {
     "basis": "paraphrased",
     "note": "the body and the world around it: the light widened around the figure"
    }
   },
   "scripted": true,
   "confidence": 0.88
  },
  {
   "id": "i03",
   "stage": "awareness",
   "action": "caution",
   "spans": [
    {
     "passage": "vbt-body:p1.s3",
     "quote": "Let this be felt rather than thought.",
     "segment": "vbt-body",
     "start": 165,
     "end": 202
    }
   ],
   "scripted": true,
   "confidence": 0.9
  },
  {
   "id": "i04",
   "stage": "awareness",
   "action": "widen",
   "spans": [
    {
     "passage": "vbt-body:p1.s4",
     "quote": "When the mind narrows back to \"me\" and \"mine\", return to the wider field and rest there.",
     "segment": "vbt-body",
     "start": 203,
     "end": 291
    }
   ],
   "scripted": true,
   "confidence": 0.9
  },
  {
   "id": "i05",
   "stage": "awareness",
   "action": "intent",
   "spans": [
    {
     "passage": "vbt-body:p1.s5",
     "quote": "The body stays where it is; only the sense of it being separate softens.",
     "segment": "vbt-body",
     "start": 292,
     "end": 364
    }
   ],
   "scripted": false,
   "exclude_reason": "a described result: never narrated as a target",
   "confidence": 0.9
  },
  {
   "id": "i90",
   "stage": "whole-field",
   "action": "caution",
   "spans": [
    {
     "passage": "vbt-body:p2.s1",
     "quote": "If you feel disoriented, unreal or anxious, open the eyes, feel the feet and the seat, and stop for today.",
     "segment": "vbt-body",
     "start": 366,
     "end": 472
    }
   ],
   "scripted": false,
   "exclude_reason": "a safety condition: shown on the start card and in Ask, not narrated",
   "confidence": 0.95
  },
  {
   "id": "i91",
   "stage": "whole-field",
   "action": "caution",
   "spans": [
    {
     "passage": "vbt-body:p3.s1",
     "quote": "If you have a history of trauma, dissociation, psychosis or severe anxiety, keep sits short with eyes open, or practise with a qualified teacher or clinician.",
     "segment": "vbt-body",
     "start": 474,
     "end": 632
    }
   ],
   "scripted": false,
   "exclude_reason": "a safety condition: shown on the start card and in Ask, not narrated",
   "confidence": 0.95
  },
  {
   "id": "i92",
   "stage": "whole-field",
   "action": "teacher_advice",
   "spans": [
    {
     "passage": "vbt-body:p4.s1",
     "quote": "The rest of the Vijñāna Bhairava (breath retention, mantra, the subtle-body and burning practices) is learned from a qualified teacher in the Trika tradition",
     "segment": "vbt-body",
     "start": 634,
     "end": 791
    }
   ],
   "scripted": false,
   "exclude_reason": "orientation, shown on the start card",
   "confidence": 0.95
  }
 ],
 "coverage_rules": [],
 "extractor": {
  "tool": "satsang-extract/1",
  "mode": "agent-manual",
  "agent": "hark subagent (satsang practice-player rethink)",
  "prompt": "tools/extract/PROMPT.md v1",
  "date": "2026-10-25",
  "note": "No model spend. Source is Satsang’s own CC BY 4.0 summary of the verses (the Wallis translation is all rights reserved: cite-only-source); agent draft per PROMPT.md §A, validated by extract.mjs."
 },
 "passages_sha256": "5b9e462b0122479a8a8386db09a7f52dd73d5155b5cb7398127b8cb78966e8c4",
 "coverage": [
  {
   "passage": "vbt-body:p1.s1",
   "status": "extracted",
   "instructions": [
    "i01"
   ]
  },
  {
   "passage": "vbt-body:p1.s2",
   "status": "extracted",
   "instructions": [
    "i02"
   ]
  },
  {
   "passage": "vbt-body:p1.s3",
   "status": "extracted",
   "instructions": [
    "i03"
   ]
  },
  {
   "passage": "vbt-body:p1.s4",
   "status": "extracted",
   "instructions": [
    "i04"
   ]
  },
  {
   "passage": "vbt-body:p1.s5",
   "status": "extracted",
   "instructions": [
    "i05"
   ]
  },
  {
   "passage": "vbt-body:p2.s1",
   "status": "extracted",
   "instructions": [
    "i90"
   ]
  },
  {
   "passage": "vbt-body:p3.s1",
   "status": "extracted",
   "instructions": [
    "i91"
   ]
  },
  {
   "passage": "vbt-body:p4.s1",
   "status": "extracted",
   "instructions": [
    "i92"
   ]
  }
 ],
 "validation": {
  "errors": [],
  "warnings": []
 }
}
